root_paper_id,ref_id,ref_title,published,ref_authors,in_text_citation_count,title_similarity,author_overlap,abstract_and_reference_title_similarity ,standalone,first_quarter,second_quarter,third_quarter,fourth_quarter,reference_relevance
36,b6,Judging borrowers by the company they keep: Friendship networks and information asymmetry in online peer-to-peer lending,2013,"['M Lin', 'N Prabhala', 'S Viswanathan']",1,0.2727272727272727,0,0.29514979597122487,1,0,0,0,2,0
36,b7,Reputation transferability in online labor markets,2015,"['M Kokkodis', 'P Ipeirotis']",1,0.4375,0,0.39378766933759723,0,0,0,0,2,0
36,b8,"Innovation contests, open innovation, and multiagent problem solving",2008,"['C Terwiesch', 'Y Xu']",2,0.3424657534246575,0,0.11237822733688874,0,0,0,0,4,0
37,b0,Strategic Response to Institutional Influences on Information Systems Outsourcing,1997,"['S Ang', 'L Cummings']",2,0.3258426966292135,0,0.06851887098275317,0,1,0,1,0,0
37,b1,Production and Transaction Economies and IS Outsourcing: A Study of the U.S. Banking Industry,1998,"['S Ang', 'D Straub']",3,0.3368421052631579,0,0.29299901685260465,0,1,0,2,0,1
37,b2,The Market for 'Lemons': Quality Uncertainty and the Market Mechanism,1970,['G Akerlof'],1,0.3253012048192771,0,0.12818706987301454,0,1,0,0,0,0
37,b3,Evidence of the effect of trust building technology in electronic markets,2002,"['S Ba', 'P Pavlou']",1,0.3058823529411765,0,0.2470483026652182,0,0,0,0,1,1
37,b4,Toward an Assessment of Software Development Risk,1993,"['H Barki', 'S Rivard', 'J Talbot']",3,0.3287671232876712,0,0.18128389273528472,1,0,1,0,4,1
37,b5,An experimental analysis of multi-attribute auction,2000,['M Bichler'],1,0.14864864864864866,0,0.12948849481091765,0,1,0,0,0,1
37,b6,Configurable Offers and Winner Determination in Multi-attribute Auctions,2005,"['M Bichler', 'J Kalagnanam']",1,0.20118343195266272,0,0.13703774196550633,0,1,0,0,0,0
37,b7,How Effective Are Electronic Reputation Mechanisms? An Experimental Investigation,2004,"['G Bolton', 'E Katok', 'A Ockenfels']",1,0.25842696629213485,0,0.04567924732183544,0,0,0,0,1,0
37,b8,Global Software Teams,1999,['E Carmel'],1,0.2711864406779661,0,0.039559388606461784,0,0,0,0,2,0
37,b9,Small Firms and Offshore Software Outsourcing: High Transaction Costs and Their Mitigation,2005,"['E Carmel', 'B Nicholson']",9,0.2887700534759358,0,0.2563741397460291,0,1,0,1,13,1
37,b10,"Speed, Stealth, and Selective Attack: How Small Firms Differ from Large Firms in Competitive Behavior",1995,"['M Chen', 'D Hambrick']",1,0.20202020202020202,0,0.26589227520937436,0,0,0,0,2,0
37,b11,"Better, Faster, Cheaper: An Experimental Analysis of a Multi-attribute Reverse Auction Mechanism with Restricted Information Feedback",2005,"['C Chen-Ritzo', 'T Harrison', 'A Kwasnica', 'D Thomas']",2,0.26956521739130435,0,0.13703774196550633,0,1,0,1,0,0
37,b13,Differences in Large and Small Firm Reponses to Environmental Context: Strategic Implications from a Comparative Analysis of Business Formations,1998,"['T Dean', 'R Brown', 'C Bamford']",7,0.3153526970954357,0,0.3553011609484402,0,3,0,1,6,0
37,b14,Reputation Mechanism Design in Online Trading Environments with Pure Moral Hazard,2005,['C Dellarocas'],1,0.2696629213483146,0,0.14461451843272152,0,0,0,0,1,1
37,b15,Contracts in Offshore Software Development,2003,"['A Gopal', 'K Sivaramakrishnan', 'M Krishnan', 'T Mukhopadhyay']",2,0.33093525179856115,0,0.09192771195538434,1,0,0,0,4,0
37,b16,The Resource-based Theory of Competitive Advantage: Implications for Strategy Formulation,1991,['R Grant'],1,0.3333333333333333,0,0.14461451843272152,0,0,0,0,1,0
37,b17,Econometric Analysis,2003,['W Greene'],2,0.17094017094017094,0,0.0,1,0,0,0,4,0
37,b18,The Effects of Service Quality and Partnership on the Outsourcing of Information Systems Functions,1996,"['V Grover', 'M Cheon', 'J Teng']",5,0.38974358974358975,0,0.2745508970965219,0,1,1,1,2,1
37,b20,Methods and Applications of Linear Models,1996,['R Hocking'],1,0.2608695652173913,0,0.19580898360256083,0,0,0,0,2,0
37,b21,Managing Cross-Cultural Issues in Global Software Outsourcing,2004,"['S Krishna', 'S Sahay', 'G Walsham']",1,0.25316455696202533,0,0.07267523746672638,0,0,0,0,2,0
37,b22,The Information Systems Outsourcing Bandwagon,1993,"['M Lacity', 'R Hirschheim']",2,0.36619718309859156,0,0.06128514130358956,0,0,0,1,2,0
37,b23,Effect of Partnership Quality on IS Outsourcing: Conceptual Framework and Empirical Validation,1999,"['J Lee', 'Y Kim']",2,0.35602094240837695,0,0.15823755442584714,0,0,1,1,0,1
37,b24,Developing Synergies between Promotions and Brands in Different Price-Quality Tiers,2002,"['K Lemon', 'S Nowlis']",2,0.3333333333333333,0,0.14461451843272152,0,0,0,0,4,0
37,b25,Determinants of Information Technology Outsourcing: A Cross-Sectional Analysis,1992,"['L Loh', 'N Venkatraman']",2,0.30857142857142855,0,0.09690031662230184,0,0,0,2,0,1
37,b26,Portfolio Approach to Information Systems,1981,['F Mcfarlan'],1,0.2318840579710145,0,0.09192771195538434,0,0,0,0,2,0
37,b27,"Outsourcing, Firm Size, and Product Complexity: Evidence from Credit Unions",2005,"['V Ono', 'V Stango']",2,0.3488372093023256,0,0.15167298650610384,0,1,0,0,1,0
37,b28,Building Effective Online Marketplaces with Institution-Based Trust,2004,"['P Pavlou', 'D Gefen']",2,0.25609756097560976,0,0.14535047493345277,0,0,0,0,2,1
37,b29,Leveraging Offshore IT Outsourcing by SMEs Through Online Marketplaces,2006,"['U Radkevitch', 'E Heck', 'O Koppius']",3,0.3473053892215569,0,0.15987736562642405,0,2,0,0,2,0
37,b30,Bidding for Contracts,1986,['W Samuelson'],1,0.22033898305084745,0,0.0,1,1,0,0,0,0
37,b31,Costly Bidding in Online Markets for IT Services,2003,"['E Snir', 'L Hitt']",1,0.2620689655172414,0,0.16957555408902822,0,0,0,0,1,0
37,b32,Vendor Screening in Information Technology Contracting with a Pilot Project,2004,"['E Snir', 'L Hitt']",1,0.3372093023255814,0,0.2055566129482595,0,1,0,0,0,1
37,b33,Electronic sourcing with multi-attribute auctions,2004,"['S Strecker', 'S Seifert']",1,0.3835616438356164,0,0.08391813582966892,0,1,0,0,0,1
37,b34,The Theory of Industrial Organization,1988,['J Tirole'],1,0.14925373134328357,0,0.18385542391076867,0,0,0,1,0,0
37,b35,Making a World of Difference,2001,['G Walsham'],2,0.208,0,0.13703774196550633,0,0,0,0,4,0
37,b36,"The Modern Corporation: Origin, Evolution, Attributes",19. 1981,['O Williamson'],1,0.26666666666666666,0,0.055945423886445945,0,0,0,1,0,0
37,b37,Complexity of Information Systems Development Projects: Conceptualization and measurement Development,2005,"['W Xia', 'G Lee']",1,0.29292929292929293,0,0.17801724872907804,0,0,0,0,2,1
37,b38,Management of Large Software Development Efforts,1980,['R Zmud'],1,0.2206896551724138,0,0.22378169554578378,0,0,0,0,2,1
38,b0,The Sunk Cost and Concorde Effects: Are Humans Less Rational Than Lower Animals,1999,"['H Arkes', 'P Ayton']",1,0.08641975308641975,0,0.23674883441205183,1,0,0,0,2,0
38,b1,"The Winner's Curse, Reserve Prices, and Endogenous Entry: Empirical Insights from eBay Auctions",2003,"['P Bajari', 'A Hortacsu']",1,0.10112359550561797,0,0.2470422619951845,0,1,0,0,0,0
38,b2,Reducing Buyer Search Costs: Implications for Electronic Marketplaces,1997,['Y Bakos'],1,0.11842105263157894,0,0.03936479108111084,1,1,0,0,0,0
38,b3,The Social Psychology of Trust with Applications in the Internet,2002. 2004,"['F Bea', 'E Göbel', 'Lucius Stuttgart', ' Lucius', 'H Bierhoff', 'B Vornefeld']",2,0.08163265306122448,0,0.49283199900880587,0,2,0,0,0,0
38,b4,How Effective are Electronic Reputation mechanisms? An Experimental Investigation,2004,"['G Bolton', 'E Katok', 'A Ockenfels']",1,0.10975609756097561,0,0.049484641268347035,0,1,0,0,0,0
38,b5,Electronic Reverse Auction Configuration and its Impact on Buyer Price and Supplier Perceptions of Opportunism: A Laboratory Experiment,2007,"['C Carter', 'C Stevens']",1,0.10091743119266056,0,0.18731716231633877,0,1,0,0,0,0
38,b6,"Individualism, Collectivism, and Opportunism: A Cultural Perspective on Transaction Cost Economics",2002,"['C Chen', 'M Peng', 'P Saparito']",1,0.08839779005524862,0,0.14083575804390608,0,1,0,0,0,0
38,b7,Reputation Mechanism Design in Online Trading Environments with Pure Moral Hazard,2005,['C Dellarocas'],1,0.10975609756097561,0,0.05595067771787852,0,1,0,0,0,1
38,b8,Adverse Selection in Electronic Markets: Evidence from Online Stamp Auctions,2004,"['S Dewan', 'V Hsu']",2,0.10062893081761007,0,0.09389050536260406,0,2,0,0,0,0
38,b10,Determinants of Internet Auction Success and Closing Price: An Exploratory Study,2003,"['J Gilkeson', 'K Reynolds']",1,0.147239263803681,0,0.14547176206648416,0,1,0,0,0,0
38,b13,"Cooperation, Opportunism, and the Invisible Hand: Implications for Transaction Cost Theory",1990,['C Hill'],1,0.13872832369942195,0,0.29094352413296826,0,1,0,0,0,0
38,b15,"Reputation in Auctions: Theory, and Evidence from eBay",2006,"['D Houser', 'O Wooders']",2,0.145985401459854,0,0.14433756729740643,0,2,0,0,0,0
38,b16,The Clash of Civilizations and the Remaking of World Order,2002,['S Huntington'],1,0.05673758865248227,0,0.5257067355685271,0,0,1,0,0,0
38,b17,The Impact of Online Reverse Auction Design on Buyer-Supplier Relationships,2007,['S Jap'],1,0.12658227848101267,0,0.38046460848157393,1,0,1,0,0,0
38,b18,"Price, Quality and Reputation: Evidence from an Online Field Experiment",2008,"['Jin Kato', 'A ']",1,0.07792207792207792,0,0.08215419219227854,0,1,0,0,0,0
38,b19,"No Pain, No Gain: A Critical Review of the Literature on Signaling Unobservable Product Quality",2000,"['A Kirmani', 'A Rao']",1,0.10112359550561797,0,0.30618621784789724,1,1,0,0,0,0
38,b20,Electronic Multidimensional Auctions and the Role of Information Feedback,2000,"['O Koppius', 'E Van Heck', 'M Kumar']",1,0.1282051282051282,0,0.3958771301467763,0,1,0,0,0,1
38,b21,"The Role of Product Quality Information, Market State Information and Transaction Costs in Electronic Auctions",2002,"['O Koppius', 'E Van Heck']",1,0.06217616580310881,0,0.36005365199151784,0,1,0,0,0,0
38,b22,Game Theory and Economic Modelling,1990,['D Kreps'],1,0.08547008547008547,0,0.06639061303092923,0,1,0,0,0,0
38,b23,Does Reputation System Impact Online Auction Results: A Meta-Analysis,2007,"['Y Liu', 'H Chen', 'K Wei', 'K Hui']",1,0.17105263157894737,0,0.049484641268347035,0,1,0,0,0,0
38,b25,Does a Seller's Ecommerce Reputation Matter? Evidence from eBay Auctions,2002,"['M Melnik', 'J Alm']",1,0.09032258064516129,0,0.037113480951260276,0,1,0,0,0,0
38,b26,Weltordnung nach Kulturerdteilen,1995,['J Newig'],1,0.034782608695652174,0,0.0,0,0,1,0,0,0
38,b27,The Effect of Transaction Costs on Double Auction Markets,1998,"['C Noussair', 'S Robin', 'B Ruffieux']",1,0.07142857142857142,0,0.43299061109803655,0,1,0,0,0,0
38,b29,Individual and Social Determinants of Winning Bids in Online Auctions,2006,"['B Stern', 'M Stafford']",1,0.06578947368421052,0,0.19951732389553362,0,1,0,0,0,0
38,b30,Sellers' Trust and Continued Use of Online Marketplaces,2010,['H Sun'],1,0.07246376811594203,0,0.15745916432444337,0,1,0,0,0,1
38,b31,An Examination of Auction Price Determinants on eBay,2001,"['W Wan', 'H.-H Teo']",1,0.11851851851851852,0,0.2099455524325912,0,1,0,0,0,1
38,b32,Attributions of Trust in Decision Support Technologies: A Study of Recommendation Agents for E-commerce,2008,"['W Wang', 'I Benbasat']",1,0.07526881720430108,0,0.258731808559231,0,1,0,0,0,1
38,b33,The Economic Institutions of Capitalism,1985,['O Williamson'],2,0.08196721311475409,0,0.4149413314433077,0,2,0,0,0,0
38,b34,Markets and Hierarchies: Analysis and Antitrust Implication,1975,['O Williamson'],1,0.11267605633802817,0,0.0865981222196073,0,1,0,0,0,0
38,b35,The Impact of Seller Reputation on the Performance of Online Sales: Evidence from TaoBao Buy-It-Now (BIN) Data,2009,"['Q Ye', 'Y Li', 'M Kiang', 'W Wu']",1,0.05181347150259067,0,0.4643217440502265,0,1,0,0,0,0
38,b37,An Empirical Research on Taobao: Seller Reputation's Impact on Auction Price Premium. Advanced Management of Information for Globalized Enterprises,2008. September 2008,"['J Zhao', 'J Huang']",1,0.09565217391304348,0,0.2348659398624336,0,1,0,0,0,0
39,b0,"Crowdstorm: The future of innovation, ideas and problem solving",2013,"['S Abrahamson', 'P Ryder', 'B Unterberg']",1,0.2463768115942029,0,0.23254438410503858,0,1,0,0,0,0
39,b1,Critical management studies,2007,"['P Adler', 'L Forbes', 'H Willmott']",1,0.2549019607843137,0,0.0,0,1,0,0,0,0
39,b2,Crowdsourcing as a solution to distant search,2012,"['A Afuah', 'C Tucci']",2,0.35,0,0.2492065990781166,0,2,0,0,0,0
39,b3,Outsourcing to an unknown workforce: Exploring opensourcing as a global sourcing strategy,2008,"['P Ågerfalk', 'B Fitzgerald']",1,0.23170731707317074,0,0.06573259680517322,0,1,0,0,0,1
39,b4,eLancing: A review and research agenda for bridging the science-practice gap,2013,"['H Aguinis', 'S Lawal']",1,0.3443708609271523,0,0.21034430977655433,0,1,0,0,0,0
39,b5,Open innovation in digital journalism: Examining the impact of open APIs at four news organizations,2013,"['T Aitamurto', 'S Lewis']",1,0.3793103448275862,0,0.1374757252722863,0,1,0,0,0,0
39,b6,Doing critical management researchSage,2000,"['M Alvesson', 'S Deetz']",3,0.19469026548672566,0,0.0,0,2,0,0,0,0
39,b7,Crowdsourcing and work: Individual factors and circumstances influencing employability,2015,"['S Barnes', 'A Green', 'M Hoyos']",3,0.34782608695652173,0,0.32866298402586613,0,2,0,0,1,0
39,b8,Three methods of ethics: A debate,1997,"['M Baron', 'P Pettit', 'M Slote']",1,0.2037037037037037,0,0.21449383339093378,0,1,0,0,0,0
39,b9,Crowdsourcing new product ideas over time: An analysis of the Dell IdeaStorm community,2013,['B Bayus'],1,0.40993788819875776,0,0.20558166219378557,0,1,0,0,0,0
39,b10,The wealth of networks,2006,['Y Benkler'],1,0.14432989690721648,0,0.17440828807877895,0,1,0,0,0,0
39,b11,Amazon Mechanical Turk and the commodification of labour,2014,"['B Bergvall-Kåreborn', 'D Howcroft']",2,0.3053435114503817,0,0.24665056639128297,0,2,0,0,0,0
39,b12,Ethical theory and business practices: The case of discourse ethics,2006,['T Beschorner'],1,0.5070422535211268,0,0.4825865039972671,0,1,0,0,0,0
39,b13,Critical theory ethics for business and public administration,2008,['D Boje'],1,0.3088235294117647,0,0.27748188719019334,0,1,0,0,0,0
39,b14,Business ethics: A Kantian perspective,1999,['N Bowie'],1,0.2831858407079646,0,0.10900518004923684,0,1,0,0,0,0
39,b16,Doing critical IS research: The question of methodology,2001,['D Cecez-Kecmanovic'],1,0.3230769230769231,0,0.12332528319564148,0,1,0,0,0,0
39,b17,The rationality framework for a critical study of information systems,2002,"['D Cecez-Kecmanovic', 'M Janson', 'A Brown']",1,0.25,0,0.20347633609190877,1,1,0,0,0,1
39,b18,Exploring the critical agenda in information systems research,2008,"['D Cecez-Kecmanovic', 'H Klein', 'C Brooke']",2,0.38235294117647056,0,0.13874094359509667,0,2,0,0,0,1
39,b19,"IS serving the community: The pragmatic, the ethical and the moral questions",2015,"['D Cecez-Kecmanovic', 'O Marjanovic']",2,0.2251655629139073,0,0.2848075418035618,0,1,0,1,0,1
39,b20,Talking about rights: Discourse ethics and the protection of rights,1993,['S Chambers'],2,0.28169014084507044,0,0.2894971822046564,1,2,0,0,0,0
39,b21,Infusing ethical considerations in knowledge management scholarship: Toward a research agenda,2013,"['S Chatterjee', 'S Sarker']",1,0.3333333333333333,0,0.1654582299419201,0,1,0,0,0,1
39,b22,A deontological approach to designing ethical collaboration,2009,"['S Chatterjee', 'S Sarker', 'M Fuller']",1,0.19402985074626866,0,0.16020424226450353,0,1,0,0,0,1
39,b23,Crowdsourcing for a better world: On the relation between IT affordances and donor motivations in charitable crowdfunding,2016,"['K Choy', 'D Schlagwein']",1,0.2653061224489796,1,0.3597170941624816,0,1,0,0,0,1
39,b24,Getting results from crowds: The definitive guide to using crowdsourcing to grow your business,2011,"['R Dawson', 'S Bynghall']",1,0.3668639053254438,0,0.22891087810339739,0,1,0,0,0,0
39,b25,The duality of empowerment and marginalization in microtask crowdsourcing: Giving voice to the less powerful through value sensitive design,2016,"['X Deng', 'K Joshi', 'R Galliers']",9,0.411214953271028,0,0.35204583014405655,0,2,0,0,7,1
39,b26,Crowdsourcing systems on the world-wide web,2011,"['A Doan', 'A Halevy', 'R Ramakrishnan']",1,0.3559322033898305,0,0.2636805467685487,0,1,0,0,0,0
39,b27,Discourse and normative business ethics,2013,"['P Edward', 'H Willmott']",2,0.2631578947368421,0,0.31199103038681275,0,2,0,0,0,0
39,b28,Towards an integrated crowdsourcing definition,2012,"['E Estellés-Arolas', 'F González-Ladrón-De-Guevara']",1,0.4462809917355372,0,0.17549495459258216,0,1,0,0,0,0
39,b29,Qualitative analysis: Practice and innovationRoutledge,2002,['D Ezzy'],1,0.23255813953488372,0,0.15599551519340638,0,1,0,0,0,0
39,b30,Working the crowd: Employment and labor law in the crowdsourcing industry,2011,['A Felstiner'],6,0.40540540540540543,0,0.3627911685772687,0,3,0,0,3,0
39,b31,Habermas: A very short introductionOxford University Press,2005,['J Finlayson'],3,0.22556390977443608,0,0.017800471362722614,1,2,0,1,0,0
39,b32,Digital labor is the new killer app,2012,"['A Fish', 'R Srinivasan']",6,0.2909090909090909,0,0.06592013669213717,0,3,0,0,3,0
39,b33,Making social science matter: Why social inquiry fails and how it can succeed againCambridge,2001,['B Flyvbjerg'],1,0.2994011976047904,0,0.1308062160590842,0,1,0,0,0,0
39,b34,Five misunderstandings about case-study research,2004,['B Flyvbjerg'],1,0.1951219512195122,0,0.03560094272544523,0,1,0,0,0,0
39,b36,Whom should firms attract to open innovation platforms? The role of knowledge diversity and motivation,2011,"['K Frey', 'C Lüthje', 'S Haag']",1,0.2711864406779661,0,0.21390212513705786,0,1,0,0,0,0
39,b37,The pros and cons of crowdsourcing,2013,['T Fung'],1,0.45871559633027525,0,0.44501178406806535,0,1,0,0,0,0
39,b38,"The theory of communicative action, volume I, reason and the rationalization of society [German original: Theorie des Kommunikativen Handelns, band 1, Handlungsrationalität und gesellschaftliche Rationalisierung, Suhrkamp",1984. 1981,['J Habermas'],4,0.006756756756756757,0,0.20600042716292866,0,4,0,0,0,0
39,b39,"The theory of communicative action, volume II, lifeworld and system, a critique of functionalist reason [German original: Theorie des Kommunikativen Handelns",1987. 1981,['J Habermas'],3,0.3620689655172414,0,0.1952158527729445,0,3,0,0,0,0
39,b40,"Moral consciousness and communicative action [German original: Moralbewusstsein und kommunikatives Handeln, Suhrkamp",1990. 1993,['J Habermas'],7,0.32460732984293195,0,0.10069467207118483,0,4,0,1,2,0
39,b43,The inclusion of the other [German Original: Die Einbeziehung des Anderen: Studien zur politischen Theorie,1998. 1996,['J Habermas'],1,0.22099447513812154,0,0.12690066948211043,0,0,0,1,0,0
39,b44,From Habermas's communicative theory to practice on the internet,2003,"['M Heng', 'A De Moor']",2,0.31654676258992803,0,0.20347633609190877,0,2,0,0,0,1
39,b45,The struggle for recognition: The moral grammar of social conflicts,1999,['A Honneth'],1,0.2112676056338028,0,0.20138934414236967,0,1,0,0,0,0
39,b46,Redistribution or recognition? A political-philosophical exchange,2003,['A Honneth'],2,0.14285714285714285,0,0.017800471362722614,0,2,0,0,0,0
39,b47,The condition of the turking class: Are online employers fair and honest?,2011,['J Horton'],5,0.24324324324324326,0,0.2563691661946489,0,3,0,0,2,0
39,b48,Crowdsourcing: A comprehensive literature review,2015,"['M Hossain', 'I Kauranen']",1,0.3252032520325203,0,0.19620932408862632,0,1,0,0,0,0
39,b49,Handbook of critical information systems research: Theory and applicationEdward Elgar,2005,"['D Howcroft', 'E Trauth']",1,0.3,0,0.17924641577041348,0,1,0,0,0,0
39,b50,The cultural work of microwork,2015,['L Irani'],4,0.26666666666666666,0,0.15599551519340638,0,2,0,0,2,0
39,b51,Turkopticon: Interrupting worker invisibility in Amazon mechanical Turk,2013,"['L Irani', 'M Silberman']",2,0.1232876712328767,0,0.09249396239673112,0,1,0,0,1,0
39,b52,From critical design to critical infrastructure,2014,"['L Irani', 'M Silberman']",2,0.26229508196721313,0,0.07707830199727592,0,1,0,0,1,0
39,b53,Why do users contribute to firm-hosted user communities? The case of computer-controlled music instruments,2006,"['L Jeppesen', 'L Frederiksen']",1,0.09944751381215469,0,0.1308062160590842,0,1,0,0,0,0
39,b54,Marginality and problem-solving effectiveness in broadcast search,2010,"['L Jeppesen', 'K Lakhani']",2,0.3,0,0.2004035851929174,0,2,0,0,0,0
39,b55,Managing the human cloud,2013,"['E Kaganer', 'E Carmel', 'R Hirschheim', 'T Olsen']",1,0.2828282828282828,0,0.08720414403938948,1,1,0,0,0,0
39,b56,Grundlegung zur Metaphysik der Sitten [groundwork of the metaphysic of morals],1785,['I Kant'],1,0.1568627450980392,0,0.14511646743090748,0,1,0,0,0,0
39,b58,Kritik der praktischen Vernunft,1788,['I Kant'],1,0.32075471698113206,0,0.0,0,1,0,0,0,0
39,b60,Die Metaphysik der Sitten [Metaphysics of Morals,1797,['I Kant'],1,0.0975609756097561,0,0.06592013669213717,0,1,0,0,0,0
39,b61,Medien und Ethik [media and ethics,2002,['M Karmasin'],1,0.27522935779816515,0,0.23140612771539398,0,1,0,0,0,0
39,b64,Un(der)paid innovators: The commercial utilization of consumer work through crowdsourcing,2008,"['F Kleemann', 'G Voß', 'K Rieder']",6,0.3048780487804878,0,0.21397617815126777,0,4,0,0,2,0
39,b65,"Open innovation and organizational boundaries: Task decomposition, knowledge distribution and the locus of innovation",2013,"['K Lakhani', 'H Lifshitz-Assaf', 'M Tushman']",1,0.28125,0,0.24665056639128302,0,1,0,0,0,0
39,b66,Why hackers do what they do: Understanding motivation and effort in free/open source software projects,2005,"['K Lakhani', 'R Wolf']",1,0.3163841807909605,0,0.14387949706158176,0,1,0,0,0,0
39,b67,Human computation,2011,"['E Law', 'L Von Ahn']",1,0.21739130434782608,0,0.0,0,1,0,0,0,0
39,b68,Leveraging crowdsourcing: Activation-supporting components for IT-based ideas competition,2009,"['J Leimeister', 'M Huber', 'U Bretschneider', 'H Krcmar']",2,0.3902439024390244,0,0.1930346015989068,0,2,0,0,0,1
39,b69,Code and other laws of cyberspaceBasic Books,1999,['L Lessig'],1,0.31932773109243695,0,0.1977604100764115,1,0,0,0,1,0
39,b70,After virtue: A study in moral theory,1981,['A Macintyre'],1,0.30357142857142855,0,0.1424037709017809,0,1,0,0,0,0
39,b71,Towards an information systems perspective and research agenda on crowdsourcing for innovation,2013,"['A Majchrzak', 'A Malhotra']",1,0.41420118343195267,0,0.3020840162135545,0,1,0,0,0,1
39,b73,Habermas' discourse ethics and principle of universalization as a moral framework for organizational communication,2006,['R Meisenbach'],1,0.17989417989417988,0,0.31441901276696615,0,0,0,1,0,0
39,b74,TradeStream your way to profits: Building a killer portfolio in the age of social mediaJohn,2011,['Z Miller'],1,0.26506024096385544,0,0.1864503026870174,0,1,0,0,0,0
39,b75,Toward ethical information systems: The contribution of discourse ethics,2010,"['J Mingers', 'G Walsham']",8,0.35374149659863946,0,0.30521450413786316,0,5,0,1,2,1
39,b76,A Set of principles for conducting critical research in information systems,2011,"['M Myers', 'H Klein']",2,0.32,0,0.1930346015989068,0,1,0,0,0,1
39,b77,Social research methods: Qualitative and quantitative approaches (7e),2014,['W Neuman'],1,0.2222222222222222,0,0.12332528319564148,0,1,0,0,0,0
39,b78,Communication richness in electronic mail: Critical social theory and the contextuality of meaning,1997,"['O Ngwenyama', 'A Lee']",1,0.2543352601156069,0,0.2660468569566637,0,1,0,0,0,0
39,b79,"Call for papers, track on 'crowdsourcing, crowdfunding, blockchain and the sharing economy",2016,"['J Nickerson', 'A Sundararajan', 'R Teigland']",1,0.4121212121212121,0,0.35243135224914696,0,1,0,0,0,0
39,b80,The fragility of goodness: Luck and ethics in Greek tragedy and philosophy,2001,['M Nussbaum'],1,0.3087248322147651,0,0.396206893209912,0,1,0,0,0,0
39,b81,The Algorithm and the Crowd: Considering the Materiality of Service Innovation,2015,"['W Orlikowski', 'S Scott']",1,0.39215686274509803,0,0.25380133896422086,0,1,0,0,0,1
39,b82,"Conceptual foundations of crowdsourcing: A review of IS research, Hawaii International Conference on System Sciences (HICSS)",2013,"['J Pedersen', 'D Kocsis', 'A Tripathi', 'A Tarrell', 'A Weerakoon', 'N Tahmasbi', 'G.-J De Vreede']",1,0.39195979899497485,0,0.21150111580351738,0,1,0,0,0,1
39,b83,Longitudinal Field Research on Change: Theory and Practice,1990,['A Pettigrew'],1,0.3007518796992481,0,0.2158192455923726,0,1,0,0,0,0
39,b85,Human computation: A survey and taxonomy of a growing field,2011,"['A Quinn', 'B Bederson']",1,0.31343283582089554,0,0.2004035851929174,0,1,0,0,0,0
39,b86,The share-the-scraps economy,2015,['R Reich'],1,0.17475728155339806,0,0.13184027338427434,0,1,0,0,0,0
39,b87,What is a 'fair' price? Ethics as sensemaking,2015,"['J Reinecke', 'S Ansari']",3,0.25,0,0.13184027338427434,0,3,0,0,0,0
39,b88,Habermas and information systems research: New directions. Information and Organization,2011,"['A Ross', 'M Chiasson']",1,0.19753086419753085,0,0.19810344660495596,0,1,0,0,0,1
39,b89,We are dynamo: Overcoming stalling and friction in collective action for crowd workers,2015,"['N Salehi', 'L Irani', 'M Bernstein', 'A Alkhatib', 'E Ogbe', 'K Milland']",1,0.2981366459627329,0,0.3023259738143906,0,1,0,0,0,0
39,b90,"Rules of crowdsourcing: Models, issues and systems of control",2013,"['G Saxton', 'O Oh', 'R Kishore']",1,0.4117647058823529,0,0.3549560227479355,0,1,0,0,0,1
39,b91,Toward a political conception of corporate responsibility: Business and society seen from a Habermasian perspective,2007,"['A Scherer', 'G Palazzo']",1,0.4105263157894737,0,0.1693025453360587,0,1,0,0,0,0
