root_paper_id,ref_id,ref_title,published,ref_authors,in_text_citation_count,title_similarity,author_overlap,abstract_and_reference_title_similarity ,standalone,first_quarter,second_quarter,third_quarter,fourth_quarter,reference_relevance
26,b50,Productivity levels and international competitiveness between Canadian and U.S. industries,2000,"['F Lee', 'J Tang']",1,0.2222222222222222,0,0.12158110873601291,0,0,1,0,0,0
26,b52,"IT outsourcing strategies: Universalistic, contingency, and configurational explanations of success",2004,"['J Lee', 'S Miranda', 'Y Kim']",1,0.24444444444444444,0,0.20402454818026827,0,1,0,0,0,1
26,b54,From the vendor's perspective: Exploring the value proposition in information technology outsourcing,2003,"['N Levina', 'J Ross']",1,0.2430939226519337,0,0.3125333896215557,0,1,0,0,0,1
26,b55,"Why do software firms fail? Capabilities, competitive actions, and firm survival in the software industry from 1995 to",2010. 2007,"['S Li', 'J Shang', 'S Slaughter']",2,0.21105527638190955,0,0.29755097944025266,0,2,0,0,0,1
26,b56,Effects of IT-enabled monitoring systems in online labor markets,2016,"['C Liang', 'Y Hong', 'B Gu']",1,0.3586206896551724,1,0.22952761670280175,0,1,0,0,0,1
26,b57,"The influence of the country-of-origin image, product knowledge and product involvement on consumer purchase decisions: An empirical study of insurance and catering services in Taiwan",2006,"['L Lin', 'C Chen']",1,0.13636363636363635,0,0.32284951842752485,0,1,0,0,0,0
26,b58,Effectiveness of reputation in contracting for customized production: Evidence from online labor markets,2018,"['M Lin', 'Y Liu', 'S Viswanathan']",1,0.3027027027027027,0,0.30196355532243346,0,1,0,0,0,0
26,b59,Research commentary-Too big to fail: Large samples and the p-value problem,2013,"['M Lin', 'Lucas Hc', 'G Shmueli']",1,0.25806451612903225,0,0.19788858380138052,0,0,0,1,0,1
26,b60,Determinants of information technology outsourcing: A cross-sectional analysis,1992,"['L Loh', 'N Venkatraman']",1,0.2641509433962264,0,0.1283098384152452,0,1,0,0,0,1
26,b61,Real exchange rate behavior: The recent float from the perspective of the past two centuries,1996,"['J Lothian', 'M Taylor']",1,0.30057803468208094,0,0.31677820640907284,0,0,1,0,0,0
26,b62,The dawn of the e-lance economy,1999,"['T Malone', 'R Laubacher']",4,0.32142857142857145,0,0.27087632554329544,0,2,0,0,4,0
26,b63,Electronic markets and electronic hierarchies,1987,"['T Malone', 'J Yates', 'R Benjamin']",2,0.2857142857142857,0,0.09144599137184249,0,1,0,0,2,0
26,b64,A labor market that works: Connecting talent with opportunity in the digital age,2015,"['J Manyika', 'S Lund', 'K Robinson', 'J Valentino', 'R Dobbs']",1,0.32298136645962733,0,0.13968605915391566,0,1,0,0,0,0
26,b65,"Native language, spoken language, translation and trade",2014,"['J Melitz', 'F Toubal']",3,0.23529411764705882,0,0.06720648654545931,1,0,1,0,2,0
26,b66,Hiring and learning in online global labor markets. Working paper,2011,['R Mill'],6,0.4520547945205479,0,0.16576994539646797,0,5,0,0,2,0
26,b67,"Is the world flat or spiky? Information intensity, skills, and global service disaggregation",2007,"['S Mithas', 'J Whitaker']",1,0.28901734104046245,0,0.25722821379318406,0,0,0,0,2,1
26,b68,Doing business with strangers: Reputation in online service marketplaces,2014,"['A Moreno', 'C Terwiesch']",6,0.2875816993464052,0,0.16129556770910236,0,4,1,0,2,1
26,b69,What makes a helpful review? A study of customer reviews on amazon,2010,"['S Mudambi', 'D Schuff']",1,0.17687074829931973,0,0.1147638083514009,0,0,0,0,2,1
26,b71,Platform Revolution: How Networked Markets are Transforming the Economy and How to Make Them Work for You,2016,"['G Parker', 'M Van Alstyne', 'S Choudary']",1,0.2903225806451613,0,0.26827712251138136,0,0,0,0,2,0
26,b74,Social capital and contract duration in buyer-supplier networks for information technology outsourcing social capital and contract duration in buyer-supplier networks for information technology outsourcing,2015,"['K Ravindran', 'A Susarla', 'D Mani', 'V Gurbaxani']",2,0.04195804195804196,0,0.16775753073468527,0,2,0,0,0,1
26,b75,How global labour arbitrage will shape the world economy,2004,['S Roach'],1,0.40875912408759124,0,0.16129556770910233,0,1,0,0,0,0
26,b76,"Understanding the motivations, participation, and performance of open source software developers: A longitudinal study of the Apache projects",2006,"['J Roberts', 'I Hann', 'S Slaughter']",1,0.2972972972972973,0,0.27278123329670156,1,0,0,0,2,0
26,b77,What makes exports boom?,1997,"['M Roberts', 'J Tybout']",1,0.20952380952380953,0,0.0,1,1,0,0,0,0
26,b78,A capabilities perspective on the effects of early internationalization on firm survival and growth,2006,"['H Sapienza', 'E Autio', 'G George', 'S Zahra']",1,0.13333333333333333,0,0.30193593965130505,1,0,0,0,2,0
26,b79,Determinants of reverse auction results: An empirical examination of freelancer.com,2011,"['M Scholz', 'N Haas']",4,0.2804878048780488,0,0.13420602458774822,0,2,1,0,2,1
26,b81,"Electronic commerce, spatial arbitrage, and market efficiency",2016,"['H Subramanian', 'E Overby']",1,0.28169014084507044,0,0.07620499280986874,1,0,0,0,1,1
26,b82,"Contractual flexibility, rent seeking, and renegotiation design: An empirical analysis of information technology outsourcing contracts",2012,['A Susarla'],2,0.18604651162790697,0,0.15617376188860604,0,2,0,0,0,0
26,b83,Contracting efficiency and new firm survival in markets enabled by information technology,2011,"['A Susarla', 'A Barua']",4,0.29411764705882354,0,0.18624807887188755,0,3,1,0,0,1
26,b84,Understanding the service component of application service provision: Empirical analysis of satisfaction with ASP services,2003,"['A Susarla', 'A Barua', 'A Whinston']",1,0.2857142857142857,0,0.30528086354743394,0,1,0,0,0,1
26,b85,Contractual provisions to mitigate holdup: Evidence from information technology outsourcing,2010,"['A Susarla', 'R Subramanyam', 'P Karhade']",1,0.05813953488372093,0,0.20402454818026824,0,1,0,0,0,1
26,b86,Now it's personal: Offshoring and the shifting skill composition of the U.S. information technology workforce,2012,"['P Tambe', 'L Hitt']",1,0.23157894736842105,0,0.3225911354182047,0,0,0,0,2,0
26,b87,How offshoring affects IT workers,2010,"['P Tambe', 'L Hitt']",3,0.2807017543859649,0,0.14426714154678916,0,2,0,0,2,0
26,b88,A package for survival analysis in S. r package version 2,2014,['T Therneau'],1,0.2318840579710145,0,0.18817816232728607,0,0,0,1,0,0
26,b89,Using time dependent covariates and time dependent coefficients in the Cox model,2016,"['T Therneau', 'C Crowson', 'E Atkinson']",2,0.16149068322981366,0,0.15121459472728346,0,0,0,2,0,0
26,b90,Survival estimation for Cox regression models with time-varying coefficients using,2014,"['L Thomas', 'E Reyes']",2,0.31901840490797545,0,0.12158110873601291,1,1,0,1,0,0
26,b91,Inverted-U relationship between R&D intensity and survival: Evidence on scale and complementarity effects in UK data,2016,"['M Ugur', 'E Trushin', 'E Solomon']",1,0.1319796954314721,0,0.2151595673145452,0,1,0,0,0,0
26,b93,Modeling the success of small and medium sized online vendors in business to business electronic marketplaces in China: A motivation-capability framework,2011,"['S Wang', 'Y Hong', 'N Archer', 'Y Wang']",1,0.2905982905982906,1,0.23387857317819843,1,0,0,0,2,1
26,b94,Store survival in online marketplace: An empirical investigation,2013,"['Y Wang', 'S Wang', 'Y Fang', 'Pyk Chau']",1,0.4413793103448276,0,0.1283098384152452,0,1,0,0,0,1
26,b98,The value of reputation in an online freelance marketplace,2013,['H Yoganarasimhan'],2,0.34532374100719426,0,0.25538464887274537,0,2,0,0,0,0
27,b1,eLancing: A review and research agenda for bridging the sciencepractice gap,2013,"['H Aguinis', 'S Lawal']",1,0.20388349514563106,0,0.29814239699997197,0,1,0,0,0,0
27,b2,Vendors ' Perspectives of Coordination in the Information Technology Offshore Outsourcing Industry : An Exploratory Study from the Philippines,2016,"['A Ambe', 'M Brereton', 'M Rittenbruch']",2,0.24175824175824176,0,0.4325904563487001,0,2,0,0,0,0
27,b3,Provider feedback information and customer choice decisions on crowdsourcing marketplaces: Evidence from two discrete choice experiments,2016,"['B Assemi', 'D Schlagwein']",1,0.3595505617977528,0,0.11111111111111112,0,1,0,0,0,1
27,b4,Competition in online job marketplaces: Towards a global labour market for outsourcing services?,2014,"['N Beerepoot', 'B Lambregts']",2,0.30837004405286345,0,0.20412414523193154,0,2,0,0,0,0
27,b5,"Work experiences on MTurk: Job satisfaction, turnover, and information sharing",2016,"['A Brawley', 'C Pury']",3,0.21052631578947367,0,0.19379255804998177,0,3,0,0,0,0
27,b7,Reducing Confusion about Grounded Theory and Qualitative Content Analysis : Similarities and Differences,2014. 2003,"['J Cho', 'E Lee']",1,0.26382978723404255,0,0.20158105227158787,0,1,0,0,0,0
27,b8,Grounding Grounded Theory: Guidelines for Qualitative Inquiry,1999,['I Dey'],1,0.19791666666666666,0,0.017817416127494958,0,1,0,0,0,0
27,b9,9.1 million Pinoys remain unemployed -SWS,2016,['H Flores'],1,0.1744186046511628,0,0.0,0,0,0,0,1,0
27,b10,Why the First Provider Takes it All: The Consequences of a Low Trust Culture on Pricing and Ratings in Online Sourcing Markets,2013,"['D Gefen', 'E Carmel']",2,0.32684824902723736,0,0.4816437234393306,0,1,0,0,1,1
27,b11,How project description length and expected duration affect bidding and project success in crowdsourcing software development,2016,"['D Gefen', 'G Gefen', 'E Carmel']",1,0.25,0,0.2635231383473649,0,1,0,0,0,0
27,b12,Doing Grounded Theory Issues and Discussions,1998,['B Glaser'],1,0.17142857142857143,0,0.15396007178390023,0,1,0,0,0,0
27,b14,Remodeling Grounded Theory,2004,"['B Glaser', 'J Holton']",1,0.06369426751592357,0,0.0,1,1,0,0,0,0
27,b15,Where Did Online Platforms Come From? The Virtualization of Work Organization and the New Policy Challenges it Raises,2017,['U Huws'],1,0.24193548387096775,0,0.4848825745591514,1,0,0,0,1,0
27,b16,"Understanding workers, developing effective tasks, and enhancing marketplace dynamics: a study of a large crowdsourcing marketplace",2017,"['A Jain', 'A Sarma', ' Das', 'A Parameswaran', 'J Widom']",1,0.2900763358778626,0,0.2592724864350674,1,0,0,0,1,0
27,b17,Information systems offshoring: Research status and issues,2008,"['W King', 'G Torkzadeh']",1,0.2962962962962963,0,0.14253932901995967,0,1,0,0,0,1
27,b18,The Global Opportunity in Online Outsourcing,2015,"['S Kuek', 'C Paradi-Guilford', 'T Fayomi', 'S Imaizumi', 'P Ipeirotis', 'P Pina', 'M Singh']",2,0.2857142857142857,0,0.4233901974057256,1,1,0,0,1,0
27,b20,The Impact of ICT on Work,2016,['J Lee'],1,0.20512820512820512,0,0.3849001794597506,1,0,0,0,1,0
27,b21,Online labour markets -leveling the playing field for international service markets ?,2014,"['V Lehdonvirta', 'H Barnard', 'M Graham', 'I Hjorth']",2,0.25925925925925924,0,0.2222649531566086,0,1,0,0,1,0
27,b22,Online Labour Markets and the Persistence of Personal Networks: Evidence From Workers in Southeast Asia,2015. 2015,"['V Lehdonvirta', 'I Hjorth', 'M Graham', 'H Barnard']",2,0.23931623931623933,0,0.474692883171144,0,1,0,0,1,0
27,b23,Online Sourcing: Investigations from Service Clients' Perspective,2011,"['B Lu', 'R Hirschheim']",2,0.3163265306122449,0,0.17817416127494956,0,2,0,0,0,1
27,b24,Examining the antecedent factors of online microsourcing,2015,"['B Lu', 'R Hirschheim', 'A Schwarz']",1,0.2887700534759358,0,0.39198315480488904,0,1,0,0,0,1
27,b25,"Trust antecedents, trust and online microsourcing adoption: An empirical study from the resource perspective",2016,"['B Lu', 'T Zhang', 'L Wang', 'L Keller']",2,0.24267782426778242,0,0.36533850361304954,0,1,0,0,1,1
27,b26,Doing Business with Strangers : Reputation in Online Service Marketplaces,2014,"['A Moreno', 'C Terwiesch', 'A Moreno', 'C Terwiesch']",2,0.3333333333333333,0,0.20427529234278036,0,1,0,0,1,1
27,b27,Mobility of knowledge work and affordances of digital technologies,2017,"['S Nelson', 'M Jarrahi', 'L Thomson']",2,0.15228426395939088,0,0.3553345272593507,0,0,0,0,2,0
27,b28,Grounded suggestions for doing a grounded theory business research,2008,"['K Ng', 'S Hase']",1,0.28426395939086296,0,0.014907119849998597,0,1,0,0,0,0
27,b29,Microsourcing -Using information technology to create unexpected work relationships and entrepreneurial opportunities,2009,['L Obal'],1,0.1935483870967742,0,0.17690759253434069,0,1,0,0,0,1
27,b30,The Future of Outsourcing in the Asia-Pacific Region : Implications for Research and Practice -Panel Report from PACIS 2014,2014,"['D Sedera', 'S Lokuge', 'H Krcmar', 'S Srivastava', 'M Ravishankar']",1,0.3228346456692913,0,0.4629100498862757,0,1,0,0,0,1
27,b31,Learning demand and job autonomy of IT personnel: Impact on turnover intention,2011,"['S Shih', 'J Jiang', 'G Klein', 'E Wang']",1,0.27751196172248804,0,0.21773242158072698,0,1,0,0,0,0
27,b32,The Journal of Systems and Software The daily standup meeting : A grounded theory study,2016,"['V Stray', 'D Sjoberg', 'T Dyba']",2,0.3486238532110092,0,0.511207720338155,0,2,0,0,0,0
27,b33,"The effect of information technology on IT-facilitated coordination, IT-facilitated autonomy, and decision-makings at the individual level",2016. July,['J Sun'],1,0.18587360594795538,0,0.36769552621700474,1,0,0,0,1,0
27,b34,Commitment and work-related expectations in flexible employment forms: An empirical study of German IT freelancers,2010,"['S Süß', 'M Kleiner']",1,0.18775510204081633,0,0.3299831645537222,0,1,0,0,0,0
27,b35,Putting the 'theory' back into grounded theory: Guidelines for grounded theory studies in information systems,2010,"['C Urquhart', 'H Lehmann', 'M Myers']",3,0.10833333333333334,0,0.16710088364221676,0,3,0,0,0,1
28,b0,Crowdsourcing as a solution to distant search,2012,"['A Afuah', 'C Tucci']",13,0.3717948717948718,0,0.2632575855600672,0,8,3,0,2,0
28,b1,Time flies when you're having fun: cognitive absorption and beliefs about information technology usage,2000,"['R Agarwal', 'E Karahanna']",1,0.2347417840375587,0,0.058764252824927005,0,0,1,0,0,1
28,b2,"IT road warriors: balancing work-family, conflict, job autonomy, and work overload to mitigate turnover intentions",2006,"['M Ahuja', 'K Chudoba', 'C Kacmar', 'D Mcknight', 'J George']",1,0.32,0,0.14305114154288537,0,0,0,1,0,1
28,b3,Estimating non-response bias in mail surveys,1997,"['J Armstrong', 'T Overton']",1,0.2064516129032258,0,0.1290330868918777,1,0,0,1,0,0
28,b4,"The moderator-mediator variable distinction in social psychological research: conceptual, strategic and statistical considerations",1986,"['R Baron', 'D Kenny']",1,0.34854771784232363,0,0.26358271546729706,0,0,0,0,1,0
28,b5,Exchange and Power in Social Life,1964,['P Blau'],4,0.16666666666666666,0,0.2632575855600671,0,3,1,0,0,0
28,b7,Feelings of pride and respect as drivers of ongoing member activity on crowdsourcing platforms,2015,"['M Boons', 'D Stam', 'H Barkema']",11,0.36097560975609755,0,0.3413894588148967,0,7,2,0,2,0
28,b8,How to manage outside innovation,2009,"['K Boudreau', 'K Lakhani']",1,0.0979020979020979,0,0.11874645015519593,0,0,1,0,0,0
28,b9,Moving the crowd at iStockphoto: the composition of the crowd and motivations for participation in a crowdsourcing application,2008,['D Brabham'],5,0.35443037974683544,0,0.49311810717707294,0,2,3,0,0,0
28,b10,Moving the crowd at Threadless: motivations for participation in a crowdsourcing application,2010,['D Brabham'],5,0.41379310344827586,0,0.36598327022917176,0,2,3,0,0,0
28,b11,Foster market knowledge use in innovation: the role of internal brokers,2005,['P Cillo'],1,0.3516483516483517,0,0.3316723386451869,0,1,0,0,0,0
28,b12,What's mine is ours or is it? A study of attitudes about information sharing,1994,"['D Constant', 'S Kiesler', 'L Sproull']",1,0.1925133689839572,0,0.1371165899248297,0,0,1,0,0,1
28,b13,Information technology and open innovation: a strategic alignment perspective,2015,"['T Cui', 'H Ye', 'H Teo', 'J Li']",1,0.2765957446808511,0,0.06705522259822749,1,0,0,0,1,1
28,b14,Working Knowledge: How Organizations Manage What They Know,1998,"['T Davenport', 'L Prusak']",1,0.1893491124260355,0,0.026822089039291,0,0,1,0,0,0
28,b15,The duality of empowerment and marginalization in microtask crowdsourcing: giving voice to the less powerful through value sensitive design,2016,"['X Deng', 'K Joshi', 'R Galliers']",6,0.448,0,0.4635386774753403,0,4,1,0,1,1
28,b16,Scale Development: Theory and Applications,2003,['R Devellis'],1,0.19607843137254902,0,0.1017826715615965,0,0,0,1,0,0
28,b17,Crowdsourcing systems on the World-Wide Web,2011,"['A Doan', 'R Ramakrishnan', 'A Halevy']",1,0.3246753246753247,0,0.3154142124023677,0,1,0,0,0,0
28,b18,Orchestrating' sustainable crowdsourcing: a characterisation of solver brokerages,2012,"['J Feller', 'P Finnegan', 'J Hayes', ""P O'reilly""]",11,0.4375,0,0.22939215447444927,0,6,3,0,2,1
28,b19,Why do you return the favor in online knowledge communities? A study of the motivations of reciprocity,2016,"['Y Feng', 'H Ye']",2,0.19718309859154928,0,0.3986487969495863,0,1,0,0,1,0
28,b20,"Cognitive effort, affect, and choice",1997,"['E Garbarino', 'J Edell']",3,0.2585034013605442,0,0.13571022874879535,0,0,1,1,1,0
28,b21,Implementation team responsiveness and user evaluation of customer relationship management: a quasi-experimental design study of social exchange theory,2002,"['D Gefen', 'C Ridings']",1,0.29770992366412213,0,0.21204723241999274,0,1,0,0,0,1
28,b22,An update and extensions to SEM guidelines for administrative and social science research,2011,"['D Gefen', 'E Rigdon', 'D Straub']",3,0.26,0,0.18608680061226884,1,0,0,3,0,1
28,b23,A practical guide to factorial validity using PLS-Graph: tutorial and annotated example,2005,"['D Gefen', 'D Straub']",1,0.1919191919191919,0,0.153301007957441,0,0,0,0,1,1
28,b24,Crowdsourcing as a business model: extrinsic motivations for knowledge sharing in user-generated content websites,2017,"['N Geri', 'R Gafni', 'P Bengov']",8,0.35714285714285715,0,0.2230315284723283,0,5,1,0,2,0
28,b25,Perceptions of virtual reward systems in crowdsourcing games,2017,"['D Goh', 'E Than', 'C Lee']",2,0.3391812865497076,0,0.34868715751078305,0,0,1,0,1,0
28,b26,The impact of knowledge repositories on power and control in the workplace,2001,['P Gray'],2,0.3027027027027027,0,0.49675204068836754,0,0,1,1,0,1
28,b27,Following the crowd,2011,['S Greengard'],1,0.23076923076923078,0,0.21900143993920143,0,1,0,0,0,0
28,b28,The double-edged swords of autonomy and external knowledge: analyzing team effectiveness in a multinational company,2010,['M Haas'],1,0.18584070796460178,0,0.33299743267458637,0,0,1,0,0,0
28,b29,Development of the job diagnostic survey,1975,"['J Hackman', 'G Oldham']",2,0.23841059602649006,0,0.29422906621419265,0,0,1,1,0,0
28,b30,Multivariate Data Analysis,2009,"['J Hair', 'W Black', 'B Babin', 'R Anderson']",2,0.1897810218978102,0,0.04380028798784029,1,0,0,0,2,0
28,b31,Crowdsourcing: why the power of the crowd is driving the future of business,2008,['J Howe'],2,0.3978494623655914,0,0.4635386774753403,0,1,1,0,0,0
28,b32,"Knowledge sharing behavior in virtual communities: the relationship between trust, self-efficacy, and outcome expectations",2007,"['M Hsu', 'T Ju', 'C Yen', 'C Chang']",1,0.33476394849785407,0,0.33299743267458637,0,1,0,0,0,0
28,b33,Is anybody out there? Antecedents of trust in global virtual teams,1998,"['S Jarvenpaa', 'K Knoll', 'D Leidner']",3,0.3163841807909605,0,0.29736140706120207,0,1,1,1,0,1
28,b35,Contributing knowledge to electronic knowledge repositories: an empirical investigation,2005,"['A Kankanhalli', 'B Tan', 'K Wei']",7,0.12121212121212122,1,0.10293279475195458,0,4,2,0,1,1
28,b36,Comparing potential and actual innovators: an empirical study of mobile data services innovation,2015,"['A Kankanhalli', 'H Ye', 'H Teo']",1,0.13526570048309178,1,0.16832782203897598,0,0,1,0,0,1
28,b37,Why software projects escalate: an empirical analysis and test of four theoretical models,2000,"['M Keil', 'J Mann', 'A Rai']",1,0.28,0,0.15780733316154,0,0,0,0,1,1
28,b38,Crowdsourcing: a revised definition and introduction to new research,2017. 0007681316301215,['J Kietzmann'],2,0.3240223463687151,0,0.26822089039291,0,1,0,0,1,0
28,b39,A study of the multilevel and dynamic nature of trust in e-commerce from a cross-stage perspective,2014,['D Kim'],2,0.28708133971291866,0,0.44159523079726093,0,2,0,0,0,0
28,b40,More than fun and money: worker motivation in crowdsourcing-a study on Mechanical Turk,2011,"['N Kaufman', 'T Schulze', 'D Veit']",5,0.34517766497461927,0,0.2840531996907719,0,2,2,0,1,0
28,b41,Global CEO Outlook,2016,[' Kpmg'],1,0.09302325581395349,0,0.0,0,1,0,0,0,0
28,b43,"Humanness, and trust: rethinking trust in technology",2015,"['N Lankton', 'D Mcknight', 'J Tripp']",2,0.25766871165644173,0,0.32874540478471537,0,2,0,0,0,1
28,b44,"Leveraging crowdsourcing -theory-driven design, implementation and evaluation of activation-supporting components for IT-based idea competitions",2009,"['J Leimeister', 'M Huber', 'U Bretschneider', 'H Krcmar']",6,0.4,0,0.21159771475702085,0,3,3,0,0,1
28,b45,Towards an information systems perspective and research agenda on crowdsourcing for innovation,2013,"['A Majchrzak', 'A Malhotra']",4,0.34146341463414637,0,0.19710129594528128,0,2,0,0,2,1
28,b46,The impact of initial consumer trust on intentions to transact with a web site: a trust building model,2002,"['H Mcknight', 'V Choudhury', 'C Kacmar']",2,0.29107981220657275,0,0.4023313355893651,1,0,0,0,2,1
28,b47,Coercive Power in Social Exchange,1997,['L Molm'],5,0.2638888888888889,0,0.203565343123193,0,3,2,0,0,0
28,b49,Analysis of participation in an online photo-sharing community: a multidimensional perspective,2010,"['O Nov', 'M Naaman', 'C Ye']",5,0.35121951219512193,0,0.27448745267187885,0,0,5,0,0,0
28,b51,"Distant search, narrow attention: how crowding alters organizations' filtering of suggestions in crowdsourcing",2015,"['H Piezunka', 'L Dahlander']",1,0.27149321266968324,0,0.26301222193589996,0,1,0,0,0,0
28,b52,Common method biases in behavioral research: a critical review of the literature and recommended remedies,2003,"['P Podsakoff', 'S Mackenzie', 'J Lee', 'N Podsakoff']",3,0.28703703703703703,0,0.3548228862059768,1,0,0,1,2,0
28,b53,Cultivating trust and harvesting value in virtual communities,2008,"['C Porter', 'N Donthu']",6,0.3372093023255814,0,0.26822089039291,0,3,2,0,1,0
28,b54,The prosperous community: social capital and public life,1993,['R Putnam'],1,0.19161676646706588,0,0.21457671231432798,1,0,0,1,0,0
28,b55,Some antecedents and effects of trust in virtual communities,2002,"['C Ridings', 'D Gefen', 'B Arinze']",2,0.2807017543859649,0,0.354033512845078,0,1,0,0,1,1
28,b56,Strategies for multiattribute binary choice,1983,"['J Russo', 'B Dosher']",1,0.24675324675324675,0,0.0,0,0,1,0,0,0
28,b57,The intention-behavior gap,2016,"['P Sheeran', 'T Webb']",1,0.1897810218978102,0,0.26552513463380856,0,1,0,0,0,0
28,b58,Managerial challenges in open innovation: a study of innovation intermediation in the chemical industry,2010,"['J Sieg', 'M Wallin', 'G Krogh']",1,0.27102803738317754,0,0.3495962243811649,0,0,1,0,0,0
28,b59,The impact of ideology on effectiveness in open source software teams,2006,"['K Stewart', 'S Gosain']",1,0.24444444444444444,0,0.36598327022917176,0,0,1,0,0,1
28,b60,Validating guidelines for IS positivist research,2004,"['D Straub', 'K Boudreau', 'D Gefen']",2,0.25157232704402516,0,0.04645722098118832,0,0,0,0,2,1
28,b61,Understanding sustained participation in transactional virtual communities,2012,"['Y Sun', 'Y Fang', 'K Lim']",8,0.3675675675675676,0,0.22939215447444922,1,2,3,1,2,1
28,b62,Working for one penny: understanding why people would like to participate in online tasks with low payment,2011,"['Y Sun', 'N Wang', 'Z Peng']",1,0.25806451612903225,0,0.19319791347380164,1,1,0,0,0,0
28,b63,"Innovation contests, open innovation, and multiagent problem solving",2008,"['C Terwiesch', 'Y Xu']",2,0.2905027932960894,0,0.05997601439040671,1,1,1,0,0,0
28,b64,Bridging the qualitative-quantitative divide: guidelines for conducting mixed methods research in information systems,2013,"['V Venkatesh', 'S Brown', 'H Bala']",2,0.21929824561403508,0,0.2027559349748439,0,0,0,0,2,1
28,b65,Why should I share? Examining social capital and knowledge contribution in electronic networks of practice,2005,"['M Wasko', 'S Faraj']",3,0.2857142857142857,0,0.24330712196981266,0,2,1,0,0,1
28,b66,Using PLS path modeling for assessing hierarchical construct models: guidelines and empirical illustration,2009,"['M Wetzels', 'G Odekerken-Schröder', 'C Van-Oppen']",1,0.12903225806451613,0,0.06312293326461599,0,0,0,1,0,1
28,b67,Job scope and stress: Can job scope be too high?,1995,"['J Xie', 'G Johns']",1,0.1509433962264151,0,0.06082678049245316,0,0,1,0,0,0
28,b68,Competing to share expertise: the TaskCn knowledge sharing community,2008,"['J Yang', 'L Admic', 'M Ackerman']",3,0.18994413407821228,0,0.22759297254326444,0,1,1,0,1,0
28,b70,Leveraging crowdsourcing for organizational value co-creation,2013,"['H Ye', 'A Kankanhalli']",6,0.4186046511627907,1,0.10035906758257156,0,3,1,1,1,1
28,b71,Investigating the antecedents of organizational task crowdsourcing,2015,"['H Ye', 'A Kankanhalli']",5,0.3050847457627119,1,0.3584252413663269,0,2,3,0,0,1
28,b72,"Task design, motivation, and participation in crowdsourcing contests",2011,"['H Zheng', 'D Li', 'W Hou']",12,0.4245810055865922,0,0.36209820203042853,0,3,4,2,3,1
29,b0,Digitization and the contract labor market: A research agenda,2013,"['A Agrawal', 'J Horton', 'N Lacetera', 'E Lyons']",1,0.36,0,0.3462716805322218,1,1,0,0,0,0
29,b1,Does Standardized Information in Online Markets Disproportionately Benefit Job Applicants from Less Developed Countries?,2014,"['A Agrawal', 'N Lacetera', 'E Lyons']",1,0.35406698564593303,0,0.052351357300152286,0,0,0,0,2,0
