root_paper_id,ref_id,ref_title,published,ref_authors,in_text_citation_count,title_similarity,author_overlap,abstract_and_reference_title_similarity ,standalone,first_quarter,second_quarter,third_quarter,fourth_quarter,reference_relevance
14,b9,The Development and Consequences of New Information Infrastructures: The Case of Mashup Platforms,2012,['P Constantinides'],1,0.2318840579710145,0,0.4149712502329819,0,1,0,0,0,0
14,b10,Using Multiple Suppliers to Mitigate the Risk of It Outsourcing at Ici and Wessex Water,1998,['W Currie'],4,0.2639593908629442,0,0.36144869800612445,0,2,0,1,1,1
14,b11,Explaining Variations in Client Extra Costs between Software Projects Offshored to India,2008,"['J Dibbern', 'J Winkler', 'A Heinzl']",1,0.24242424242424243,0,0.1347039765200812,0,1,0,0,0,1
14,b12,"Modelling the Price, Performance and Contract Characteristics of It Outsourcing",2000,"['S Domberger', 'P Fernandez', 'D Fiebig']",3,0.35978835978835977,0,0.4426824391541682,0,1,1,0,1,1
14,b13,A Strategic Management Framework for It Outsourcing: A Review of the Literature and the Development of a Success Factors Model,2005,"['J Fjermestad', 'J Saitta']",1,0.3644067796610169,0,0.46387689275645594,0,1,0,0,0,1
14,b14,Distance Still Matters,2001,['P Ghemawat'],1,0.19696969696969696,0,0.0,0,1,0,0,0,0
14,b15,Vendor Capabilities and Outsourcing Success: A Resource-Based View,2003,['T Goles'],1,0.38636363636363635,0,0.20163978315436076,0,1,0,0,0,1
14,b16,Information Systems Outsourcing: A Literature Analysis,2006,"['R Gonzalez', 'J Gasco', 'J Llopis']",1,0.32926829268292684,0,0.09274777915203365,0,1,0,0,0,1
14,b17,The Role of Organizational Controls and Boundary Spanning in Software Development Outsourcing: Implications for Project Performance,2010,"['A Gopal', 'S Gosain']",3,0.2821576763485477,0,0.4018187817080398,0,1,2,0,0,1
14,b18,Econometric Analysis,2008,['W Greene'],2,0.13846153846153847,0,0.03666177875533832,0,0,0,2,0,0
14,b19,A Multi-Level Analysis of the Impact of Health Information Technology on Hospital Performance,2012,"['H Hah', 'A Bharadwaj']",1,0.2955665024630542,1,0.3212877315609995,0,0,0,0,1,1
14,b20,"Financial Performance, Ceo Compensation, and Large-Scale Information Technology Outsourcing Decisions",2005,['J Hall'],1,0.3981042654028436,0,0.18759161984421674,0,1,0,0,0,1
14,b21,Strategic Intent,1989,"['G Hamel', 'C Prahalad']",1,0.25396825396825395,0,0.2566324512873682,0,1,0,0,0,0
14,b22,It Outsourcing: Frameworks for Conceptualizing Practice and Perception,2000,"['M Hancox', 'R Hackney']",1,0.28888888888888886,0,0.2566324512873682,0,1,0,0,0,1
14,b23,Evaluating the Success in International Sourcing of Information Technology Projects: The Need for a Relational Client-Vendor Approach,2009,"['P Haried', 'K Ramamurthy']",1,0.31275720164609055,0,0.3806288544558452,1,0,1,0,0,0
14,b24,Research Report: Diffusion of Information Systems Outsourcing: A Reevaluation of Influence Sources,1997,"['Q Hu', 'C Saunders', 'M Gebelt']",1,0.3269230769230769,0,0.2300789234172203,0,1,0,0,0,1
14,b25,Exploring the Relationship between Software Project Duration and Risk Exposure: A Cluster Analysis,2008,"['S.-J Huang', 'W.-M Han']",1,0.3557692307692308,0,0.3592106040535499,0,1,0,0,0,1
14,b26,Service Augmentation and Customer Satisfaction: An Analysis of Cell Phone Services in Base-of-the-Pyramid Markets,2012,"['J Khuntia', 'S Mithas', 'R Agarwal', 'P Roy']",1,0.29596412556053814,1,0.3211555959471194,0,0,1,0,0,1
14,b27,A Relationship Perspective on It Outsourcing,2003,"['R Kishore', 'H Rao', 'K Nam', 'S Rajagopalan', 'A Chaudhury']",2,0.35064935064935066,0,0.1854955583040673,0,1,1,0,0,0
14,b28,It Outsourcing Success: A Psychological Contract Perspective,2004,"['C Koh', 'S Ang', 'D Straub']",1,0.2823529411764706,0,0.1270001270001905,0,1,0,0,0,1
14,b29,A Review of the It Outsourcing Empirical Literature and Future Research Directions,2010,"['M Lacity', 'S Khan', 'A Yan', 'L Willcocks']",2,0.3645833333333333,0,0.39081587467545154,0,2,0,0,0,1
14,b30,A Review of the It Outsourcing Literature: Insights for Practice,2009,"['M Lacity', 'S Khan', 'L Willcocks']",2,0.3103448275862069,0,0.32836803666463465,0,2,0,0,0,1
14,b31,An Empirical Investigation of Information Technology Sourcing Practices: Lessons from Experience,1998,"['M Lacity', 'L Willcocks']",10,0.34951456310679613,0,0.2032242548312348,0,8,0,1,1,1
14,b32,"It Outsourcing Strategies: Universalistic, Contingency, and Configurational Explanations of Success",2004,"['J.-N Lee', 'S Miranda', 'Y.-M Kim']",8,0.22009569377990432,0,0.27872598020818,0,6,0,1,1,1
14,b33,From the Vendor's Perspective: Exploring the Value Proposition in Information Technology Outsourcing,2003,"['N Levina', 'J Ross']",2,0.2761904761904762,0,0.2632801478500043,0,1,1,0,0,1
14,b34,Accounting for Common Method Variance in Cross-Sectional Research Designs,2001,"['M Lindell', 'D Whitney']",1,0.33879781420765026,0,0.06558258357839529,0,0,0,1,0,0
14,b35,Outsourcing as a Strategy for Driving Transformation,2004,['J Linder'],1,0.20987654320987653,0,0.10583343916682543,0,1,0,0,0,0
14,b36,Determinants of Information Technology Outsourcing: A Cross-Sectional Analysis,1992,"['L Loh', 'N Venkatraman']",2,0.35106382978723405,0,0.1833088937766916,0,2,0,0,0,1
14,b38,Strategic Outsourcing of It Services: Theoretical Stocktaking and Empirical Challenges,2005,"['V Mahnke', 'M Overby', 'J Vang']",1,0.29591836734693877,0,0.3607042096811741,0,1,0,0,0,0
14,b39,The Impact of Firm Learning on Financial Value in Strategic Outsourcing Relationships,2009,"['D Mani', 'A Barua', 'A Whinston']",2,0.27692307692307694,0,0.2993421700446249,0,2,0,0,0,1
14,b40,Strategy Making as Iterated Processes of Resource Allocation,1996,"['T Noda', 'J Bower']",1,0.27058823529411763,0,0.1283162256436841,0,1,0,0,0,0
14,b41,A Cognitive Model of the Antecedents and Consequences of Satisfaction Decisions,1980,['R Oliver'],2,0.2857142857142857,0,0.3741777125557811,0,1,1,0,0,0
14,b42,"Cognitive, Affective, and Attribute Bases of the Satisfaction Response",1993,['R Oliver'],2,0.2777777777777778,0,0.32836803666463465,0,1,1,0,0,0
14,b43,"Capability, Quality, and Performance of Offshore Is Vendors: A Theoretical Framework and Empirical Investigation",2010,"['P Palvia', 'R King', 'W Xia', 'S Palvia']",1,0.35135135135135137,0,0.38822267563620777,0,0,1,0,0,0
14,b45,Organizational Adoption of Web 2.0 Technologies: An Empirical Analysis,2012,"['T Saldanha', 'M Krishnan']",1,0.26666666666666666,1,0.14664711502135327,0,1,0,0,0,1
14,b46,Information Systems for Collaborating Versus Transacting: Impact on Manufacturing Plant Performance in the Presence of Demand Volatility,2013,"['T Saldanha', 'N Melville', 'R Ramirez', 'V Richardson']",1,0.3008130081300813,1,0.238922841043232,0,1,0,0,0,0
14,b47,Is Application Capabilities and Relational Value in Interfirm Partnerships,2007,"['N Saraf', 'C Langdon', 'S Gosain']",1,0.1956521739130435,0,0.17282528245507087,0,1,0,0,0,1
14,b48,How Peripheral Developers Contribute to Open-Source Software Development,2012,"['P Setia', 'B Rajagopalan', 'V Sambamurthy', 'R Calantone']",1,0.32967032967032966,0,0.051847584736521256,0,1,0,0,0,1
14,b49,Leveraging Digital Technologies: How Information Quality Leads to Localized Capabilities and Customer Service Performance,2013,"['P Setia', 'V Venkatesh', 'S Joglekar']",1,0.2683982683982684,0,0.1801390485289503,0,0,0,0,1,1
14,b50,Understanding the Service Component of Application Service Provision: An Empirical Analysis of Satisfaction with Asp Services,2003,"['A Susarla', 'A Barua', 'A Whinston']",1,0.28936170212765955,0,0.24346292027408836,0,1,0,0,0,1
14,b51,Contractual Provisions to Mitigate Holdup: Evidence from Information Technology Outsourcing,2010,"['A Susarla', 'R Subramanyam', 'P Karhade']",5,0.4577114427860697,0,0.09837387536759293,0,3,1,1,0,1
14,b52,A Process-Oriented Perspective on the Alignment of Information Technology and Business Strategy,2007,['P Tallon'],2,0.06829268292682927,0,0.32927638704908735,0,1,0,0,1,1
14,b53,Competing Perspectives on the Link between Strategic Information Technology Alignment and Organizational Agility: Insights from a Mediation Model,2011,"['P Tallon', 'A Pinsonneault']",2,0.3215686274509804,0,0.2766475001553213,0,1,0,0,1,1
14,b54,"A Comparison of Transaction Cost, Agency, and Knowledge-Based Predictors of It Outsourcing Decisions: A U.S.-Japan Cross-Cultural Field Study",2007,"['A Tiwana', 'A Bush']",1,0.3346613545816733,0,0.2898368098501052,0,1,0,0,0,1
14,b55,Control in Internal and Outsourced Software Projects,2009,"['A Tiwana', 'M Keil']",1,0.38271604938271603,0,0.17636890537566463,0,1,0,0,0,1
14,b56,Outsourcing: Think More Expansively,2009,['R Varadarajan'],1,0.20689655172413793,0,0.05184758473652126,0,1,0,0,0,0
14,b57,Toys Become Tools: From Virtual Worlds to Real Commerce,2011,"['S Vitzthum', 'A Kathuria', 'B Konsynski']",1,0.2909090909090909,1,0.051847584736521256,1,1,0,0,0,1
14,b58,The Demands-Control Model of Job Strain: A More Specific Test,1996,"['T Wall', 'P Jackson', 'S Mullarkey', 'S Parker']",1,0.2807017543859649,0,0.19674775073518588,0,0,0,1,0,0
14,b59,The Cost Behavior of Software Defects,2004,['J Westland'],2,0.1360544217687075,0,0.2751669418337461,1,0,2,0,0,1
14,b60,Complexity of Information Systems Development Projects: Conceptualization and Measurement Development,2005,"['W Xia', 'G Lee']",1,0.15165876777251186,0,0.22450662753346867,0,1,0,0,0,1
15,b0,Outsourcing to an unknown workforce: exploring open sourcing as an offshore sourcing strategy,2008,"['P Ågerfalk', 'B Fitzgerald']",9,0.31840796019900497,0,0.08651232146535212,0,5,1,0,4,1
15,b1,Resource dependence and interorganizational relations: relations between local employment service office and social services sectors organizations,1976,['H Aldrich'],1,0.13385826771653545,0,0.05800757773479474,0,1,0,0,0,0
15,b2,Environments of organizations,1976,"['H Aldrich', 'J Pfeffer']",1,0.24817518248175183,0,0.2246623825206922,0,1,0,0,0,0
15,b3,The information technology outsourcing risk: a transaction cost and agency theory-based perspective,2003,"['B Bahli', 'S Rivard']",1,0.463768115942029,0,0.2433842477307499,1,1,0,0,0,1
15,b4,Firm resources and sustained competitive advantage,1991,['J Barney'],2,0.24050632911392406,0,0.02647671569298459,1,1,0,0,1,0
15,b5,"Micro-sourcing, is this the eventual global sourcing landscape","2008. July 15, 2012",['E Carmel'],1,0.2235294117647059,0,0.273760906514371,1,1,0,0,0,0
15,b6,Offshoring Information Technology: Sourcing and Outsourcing to a Global Workforce,2005,"['E Carmel', 'P Tjia']",1,0.31746031746031744,0,0.09728166526882823,0,1,0,0,0,0
15,b7,Theoretical perspectives on the outsourcing of information systems,1995,"['M Cheon', 'V Grover', 'J Teng']",2,0.21839080459770116,0,0.3783368885818955,0,0,1,1,0,1
15,b8,The partial least squares approach to structural equation modeling,1998,['W Chin'],3,0.25287356321839083,0,0.2377996262126912,0,0,0,0,2,0
15,b9,A paradigm for developing better measures of marketing constructs,1979,"['G Churchill', 'J ']",1,0.21965317919075145,0,0.1719713129917707,0,0,0,1,0,0
15,b10,"Perceived usefulness, perceived ease of use and user acceptance of information technology",1989,['F Davis'],1,0.29441624365482233,0,0.22699055229393256,1,0,1,0,0,1
15,b11,User acceptance of computer technology: a comparison of two theoretical models,1989,"['F Davis', 'R Bagozzi', 'P Warshaw']",1,0.20430107526881722,0,0.2246623825206922,1,0,1,0,0,0
15,b12,The DeLone and McLean model of information systems success: a ten-year update,2003,"['W Delone', 'E Mclean']",1,0.2918918918918919,0,0.30891077596595184,1,0,0,0,2,1
15,b13,Handbook of Qualitative Research,2000,"['N Denzin', 'Y Lincoln']",1,0.17142857142857143,0,0.22699055229393253,1,0,0,1,0,0
15,b14,Dimensions of organizational task environments,1984,"['G Dess', 'D Beard']",2,0.11688311688311688,0,0.17402273320438422,1,1,1,0,0,0
15,b15,Information systems outsourcing: a survey and analysis of the literature,2004,"['J Dibbern', 'T Goles', 'R Hirschheim', 'B Jayatilaka']",2,0.3333333333333333,0,0.3783175871565543,1,1,0,0,1,0
15,b16,Towards an integrated crowdsourcing definition,2012,"['E Estellés-Arolas', 'F González-Ladrón-De-Guevara']",1,0.36363636363636365,0,0.02900378886739737,0,1,0,0,0,0
15,b17,"Trust, satisfaction, and online repurchase intention: the moderating role of perceived effectiveness of ecommerce institutional mechanisms",2014,"['Y Fang', 'I Qureshi', 'H Sun', 'P Mccole', 'E Ramsey', 'K Lim']",1,0.4146341463414634,0,0.481519676376958,0,1,0,0,0,1
15,b18,From peer production to productization: a study of social enabled business exchanges in open source service networks,2008,"['J Feller', 'P Finnegan', 'B Fitzgerald']",8,0.39285714285714285,0,0.2107769414157945,0,3,2,0,4,1
15,b19,"Belief, Attitude, Intention and Behavior: An Introduction to Theory and Research",1975,"['M Fishbein', 'I Ajzen']",1,0.30851063829787234,0,0.0899369313562268,1,0,0,0,1,0
15,b20,Trust: The Social Virtues and the Creation of Prosperity,1995,['F Fukuyama'],1,0.3902439024390244,0,0.5475218130287421,1,1,0,0,0,0
15,b21,E-commerce: the role of familiarity and trust,2000,['D Gefen'],3,0.1568627450980392,0,0.4779971735083051,0,0,2,0,1,0
15,b22,Is the world really flat? A look at offshoring at an online programming marketplace,2008,"['D Gefen', 'E Carmel']",9,0.27225130890052357,0,0.30141621558199694,0,3,0,0,6,1
15,b23,Why the first provider takes it all: the consequences of a low trust culture on pricing and ratings in online sourcing markets,2013,"['D Gefen', 'E Carmel']",11,0.3418803418803419,0,0.49359264951263754,0,7,0,0,4,1
15,b24,Trust and TAM in online shopping: an integrated model,2003,"['D Gefen', 'E Karahanna', 'D Straub']",2,0.34782608695652173,0,0.2594177740502086,1,1,1,0,0,1
15,b25,The boundaries of trust and risk: the quadratic moderating role of institutional structures,2012,"['D Gefen', 'P Pavlou']",3,0.4020100502512563,0,0.5426681982826634,0,3,0,0,0,1
15,b26,Structural equation modeling and regression: guidelines for research practice,2000,"['D Gefen', 'D Straub', 'M Boudreau']",1,0.3891891891891892,0,0.07566351743131083,0,0,0,0,1,1
15,b27,Facilitating relational governance through service level agreements in IT outsourcing: an application of the commitment-trust theory,2008,"['J Goo', 'C Huang']",2,0.3416666666666667,0,0.3775083118488093,1,1,0,0,1,1
15,b28,The role of service level agreements in relational management of information technology outsourcing: an empirical study,2009,"['J Goo', 'R Kishore', 'H Rao']",9,0.3788546255506608,0,0.4127311511802497,0,4,2,0,3,1
15,b29,"The relationship between contracts, relational governance, and vendor profitability in software development outsourcing",2009,"['A Gopal', 'B Koka']",1,0.30837004405286345,0,0.2698107940686804,0,0,1,0,0,0
15,b30,The resource-based theory of competitive advantage: implications for strategy formulation,1991,['R Grant'],1,0.19289340101522842,0,0.3715326588409322,1,1,0,0,0,0
15,b31,Toward knowledge-based theory of the firm,1996,['R Grant'],3,0.2684563758389262,0,0.3922028090324555,1,1,1,0,2,0
15,b32,An evaluation of the impact of corporate strategy and the role of information technology on IS functional outsourcing,1994,"['V Grover', 'M Cheon', 'T Teng']",2,0.2311111111111111,0,0.5214791151369955,0,1,1,0,0,1
15,b33,Multivariate Data Analysis,2009,"['J Hair', 'R Anderson', 'R Tatham', 'W Black']",2,0.19402985074626866,0,0.018721865210057684,1,0,0,0,1,0
15,b34,A review of scale development practices in the study of organizations,1995,['T Hinkin'],1,0.2598870056497175,0,0.4493247650413844,1,0,0,1,0,0
15,b35,The rise of crowdsourcing,2006,['J Howe'],1,0.2706766917293233,0,0.48640832634414116,0,1,0,0,0,0
15,b36,Determinants of ASP choice: an integrated perspective,2003,"['B Jayatilaka', 'A Schwarz', 'R Hirschheim']",4,0.2608695652173913,0,0.15933239116943504,0,3,0,1,0,1
15,b37,Managing the human cloud,2013,"['E Kaganer', 'E Carmel', 'R Hirschheim', 'T Olsen']",2,0.19696969696969696,0,0.2918449958064847,0,1,0,0,2,0
15,b38,The information systems outsourcing bandwagon,1993,"['M Lacity', 'R Hirschheim']",2,0.27450980392156865,0,0.2900378886739737,0,1,1,0,0,1
15,b39,Effect of partnership quality on IS outsourcing: conceptual framework and empirical validation,1999,"['J Lee', 'Y Kim']",3,0.3465346534653465,0,0.2059405173106345,0,2,0,0,1,1
15,b40,Understanding Online Sourcing Decisions From the Service Clients' Perspective: An Integrative Theoretical Framework(Dissertation),2011,['B Lu'],1,0.39662447257383965,1,0.3206619636590215,0,1,0,0,0,0
15,b41,Exploring the resource nature of online sourcing marketplace,2013,"['B Lu', 'Q Zeng']",1,0.23809523809523808,1,0.5503082015736662,1,1,0,0,0,0
15,b42,Examining the antecedent factors of online microsourcing,2015,"['B Lu', 'R Hirschheim', 'A Scharz']",2,0.4268292682926829,1,0.5637915379841548,0,2,0,0,0,1
15,b43,The dawn of the e-lance economy,1998,"['T Malone', 'R Laubacher']",1,0.2589928057553957,0,0.5503082015736662,0,0,0,0,2,0
15,b44,What makes a virtual organization work?,2000,"['M Markus', 'B Manville', 'E Agres']",1,0.14965986394557823,0,0.0,0,1,0,0,0,0
15,b45,"The governance of free/open source software projects: monolithic, multidimensional, or configurational?",2007,['M Markus'],1,0.2559241706161137,0,0.29954984336092294,0,0,0,0,2,0
15,b46,The crowd in the cloud: exploring the future of outsourcing,2013,[' Massolution'],1,0.16766467065868262,0,0.5999036024911075,1,1,0,0,0,0
15,b47,Developing and validating trust measures for e-commerce: an integrative typology,2002,"['D Mcknight', 'V Choudhury', 'C Kacmar']",10,0.30851063829787234,0,0.11279826683531767,1,6,1,0,3,1
15,b48,Knowledge integration and information technology project performance,2006,['V Mitchell'],1,0.3522727272727273,0,0.0367690133467927,1,1,0,0,0,1
15,b49,Scaling Procedures: Issues and Applications,2003,"['R Netemeyer', 'W Bearden', 'S Sharma']",1,0.304635761589404,0,0.02900378886739737,0,0,0,1,0,0
15,b50,Microsourcing -using information technology to create unexpected work relationships and entrepreneurial opportunities,2009,['L '],1,0.3022222222222222,0,0.12169212386537495,1,1,0,0,0,1
15,b51,Building effective online marketplaces with institution-based trust,2004,"['P Pavlou', 'D Gefen']",18,0.2857142857142857,0,0.2751541007868331,0,10,5,0,3,1
15,b52,"Psychological contract violation in online marketplaces: antecedents, consequences, and moderating role",2005,"['P Pavlou', 'D Gefen']",2,0.3127962085308057,0,0.2150978551184344,0,1,0,0,1,1
15,b53,Understanding and mitigating uncertainty in online exchange relationships: a principal-agent perspective,2007,"['P Pavlou', 'H Liang', 'Y Xue']",3,0.4716981132075472,0,0.1857663294204661,0,0,1,0,3,1
15,b54,A social information processing approach to job attitudes and task design,1978,"['J Pfeffer', 'G Salancik']",1,0.19889502762430938,0,0.06152632736471872,1,0,0,0,1,0
15,b55,Common method biases in behavioral research: a critical review of the literature and recommended remedies,2003,"['S Podsakoff', 'B Mackenzie', 'J Lee', 'N Podsakoff']",2,0.19718309859154928,0,0.35532812189242924,1,0,0,0,2,0
15,b56,"Testing alternative theories of the firm: transaction cost, knowledge-based, and measurement explanations for make-or-buy decisions in Information Services",1998,"['L Poppo', 'T Zenger']",1,0.3041825095057034,0,0.3255051962219849,1,0,0,0,1,0
15,b57,Portfolios of buyer-supplier exchange relationships in an online marketplace for IT services,2009,"['U Radkevitch', 'E Van Heck', 'O Koppius']",1,0.24,0,0.31477925974679377,1,1,0,0,0,1
15,b58,Offshore information systems project success: the role of social embeddedness and cultural characteristics,2009,"['A Rai', 'L Maruping', 'V Venkatesh']",8,0.32710280373831774,0,0.2967918734755484,0,4,2,0,2,1
15,b59,PLS marker variable approach to diagnosing and controlling for method variance,2011,"['M Rönkkö', 'Y Ylitalo']",1,0.27956989247311825,0,0.08799457709390499,1,0,0,0,1,1
15,b60,A conjoint approach to understanding IT application services outsourcing,2009,"['A Schwarz', 'R Hirschheim', 'B Jayatilaka', 'T Goles']",21,0.24444444444444444,0,0.08025327939615966,1,9,6,1,6,1
15,b61,Strategic information systems planning success: an investigation of the construct and its measurement,1998,"['A Segars', 'V Grover']",1,0.27751196172248804,0,0.2967918734755484,0,0,0,0,1,1
15,b63,Premiums for high quality products as returns to reputations,1983,['C Shapiro'],1,0.2261904761904762,0,0.10809073918758691,0,0,1,0,0,0
15,b64,Paid crowdsourcing: current state and progress toward mainstream business use,2009,[' Smartsheet'],2,0.34594594594594597,0,0.020508775788239574,1,2,0,0,0,0
15,b65,A-priori sample size calculator for multiple regression,2013. 27 February 2015,['D Soper'],1,0.2822085889570552,0,0.0367690133467927,1,0,0,0,1,0
15,b66,Trust transfer on the world wide web,2003,['K Stewart'],2,0.3055555555555556,0,0.3064084445566059,1,0,2,0,0,0
15,b67,Future of virtual communities as business,July 2012,[' Topcoder'],1,0.10738255033557047,0,0.19857536769738443,1,1,0,0,0,0
15,b68,"Perspectives in organizations: resource dependence, efficiency, and population",1984,"['D Ulrich', 'J Barney']",1,0.2903225806451613,0,0.1261122961939652,1,1,0,0,0,0
15,b69,The sources and consequences of embeddedness for the economic performance of organizations: the network effect,1996,['B Uzzi'],1,0.1651376146788991,0,0.5679696240967336,0,0,1,0,0,0
15,b70,Social structure and competition in interfirm networks: the paradox of embeddedness,1997,['B Uzzi'],1,0.34554973821989526,0,0.3715326588409322,0,1,0,0,0,0
15,b71,"Review: the resource-based theory and information systems research: review, extension and suggestions for future research",2004,"['M Wade', 'J Hulland']",1,0.20087336244541484,0,0.23505923486725006,1,0,0,0,1,1
15,b72,"Lower bounds on sample size in structural equation modeling, Electronic Commerce Research and Applications",2010,['J Westland'],1,0.2336448598130841,0,0.09533193514187124,1,0,0,0,1,1
15,b73,The economics of organization: the transaction cost approach,1981,['O Williamson'],1,0.32142857142857145,0,0.5024650068118696,1,0,0,0,2,0
16,b0,"The Market for"" Lemons"": Quality Uncertainty and the Market Mechanism",1970,['G References Akerlof'],1,0.14893617021276595,0,0.34096545349373814,0,1,0,0,0,0
16,b1,Production and Transaction Economies and Is Outsourcing: A Study of the Us Banking Industry,1998,"['S Ang', 'D Straub']",2,0.11428571428571428,0,0.3425800798515744,0,0,0,1,1,1
16,b2,Evidence of the Effect of Trust Building Technology in Electronic Markets: Price Premiums and Buyer Behavior,2002,"['S Ba', 'P Pavlou']",4,0.10572687224669604,1,0.348815787635399,0,2,1,1,0,1
16,b3,The Emerging Role of Electronic Marketplaces on the Internet,1998,['J Bakos'],1,0.0782122905027933,0,0.2769558547034987,1,0,0,1,0,0
16,b5,Effect of Expectation and Disconfirmation on Postexposure Product Evaluations: An Alternative Interpretation,1977,['R Oliver'],1,0.0881057268722467,0,0.17677669529663692,0,0,1,0,0,0
16,b6,"The Nature and Role of Feedback Text Comments in Online Marketplaces: Implications for Trust Building, Price Premiums, and Seller Differentiation",2006,"['P Pavlou', 'A Dimoka']",1,0.16666666666666666,1,0.3699150189058579,0,1,0,0,0,1
16,b7,"Psychological Contract Violation in Online Marketplaces: Antecedents, Consequences, and Moderating Role",2005,"['P Pavlou', 'D Gefen']",1,0.11711711711711711,1,0.18463723646899913,0,1,0,0,0,1
16,b8,Understanding and Mitigating Uncertainty in Online Exchange Relationships: A Principal-Agent Perspective,2007,"['P Pavlou', 'H Liang', 'Y Xue']",3,0.11659192825112108,1,0.16925080009658253,0,2,0,1,0,1
16,b11,"The Effect of Price, Brand Name, and Store Name on Buyers' Perceptions of Product Quality: An Integrative Review",1989,"['A Rao', 'K Monroe']",3,0.1038961038961039,0,0.282876190928009,0,1,1,0,1,0
16,b13,Last-Minute Bidding and the Rules for Ending Second-Price Auctions: Evidence from Ebay and Amazon Auctions on the Internet,2002,"['A Roth', 'A Ockenfels']",1,0.06639004149377593,0,0.2702162595460846,0,1,0,0,0,0
16,b14,"Xtoverid: Stata Module to Calculate Tests of Overidentifying Restrictions after Xtreg, Xtivreg, Xtivreg2, Xthtaylor",2006,"['M Schaffer', 'S Stillman']",1,0.13675213675213677,0,0.12274756325774575,0,0,0,0,1,0
16,b16,Costly Bidding in Online Markets for It Services,2003,"['E Snir', 'L Hitt']",9,0.10778443113772455,0,0.36084391824351614,0,3,0,4,1,0
16,b17,Job Market Signaling,1973,['M Spence'],1,0.07194244604316546,0,0.058925565098878974,0,0,1,0,0,0
16,b18,Consumer Bidding Behavior on Internet Auction Sites,2002,"['M Stafford', 'B Stern']",1,0.10588235294117647,0,0.0,0,1,0,0,0,1
16,b23,Survivors of Industry Shake Outs: The Case of the Us Color Television Set Industry,1985,"['G Willard', 'A Cooper']",1,0.1890547263681592,0,0.2738612787525831,1,0,0,0,1,0
16,b24,A Note on Robust Variance Estimation for Cluster-Correlated Data,2000,['R Williams'],1,0.17486338797814208,0,0.10206207261596575,0,0,0,0,1,0
16,b25,Econometric Analysis of Cross Section and Panel Data,2002,['J Wooldridge'],2,0.14035087719298245,0,0.2525907427704613,0,0,0,0,2,0
17,b0,Innovation and empowerment in Finland: How citizens and technology are reshaping government through crowdsourcing,2018,['T Aitamurto'],1,0.3383084577114428,0,0.2528836017010212,0,1,0,0,0,0
17,b1,"Commoditized Workers: Case Study Research on Labor Law Issues Arising from a Set of"" on-Demand/Gig Economy"" Platforms",2016,['A Aloisi'],1,0.12682926829268293,0,0.19387368815947364,0,1,0,0,0,0
17,b2,Handbook of career theory,1989,"['M Arthur', 'D Hall', 'B Lawrence']",2,0.3008849557522124,0,0.1926732203436352,0,2,0,0,0,0
17,b3,Career development: A policy statement of the national career development association,2011,['N Association'],1,0.24277456647398843,0,0.23172337868537762,0,0,1,0,0,0
